{
  "graphVersion": "1.0.0",
  "workflowId": "gw_f",
  "revision": 1,
  "name": "Welcome Sequence",
  "vss": {
    "release": "v4.0"
  },
  "variables": [],
  "blocks": [
    {
      "id": "b1",
      "type": "sv_on_app_start",
      "name": "Start",
      "props": {},
      "parentId": null,
      "blockVersion": 1
    },
    {
      "id": "b2",
      "type": "sv_parallel",
      "name": "Welcome",
      "props": {
        "join": "all"
      },
      "parentId": null,
      "blockVersion": 1
    },
    {
      "id": "b3",
      "type": "sv_set_actuator",
      "name": "Ambient on",
      "props": {
        "path": "Vehicle.Cabin.Light.AmbientLight.Row1.DriverSide.IsLightOn",
        "value": true,
        "awaitAck": true,
        "onError": "continue"
      },
      "parentId": "b2",
      "blockVersion": 1
    },
    {
      "id": "b4",
      "type": "sv_wait",
      "name": "Short pause",
      "props": {
        "durationMs": 500
      },
      "parentId": "b2",
      "blockVersion": 1
    },
    {
      "id": "b5",
      "type": "sv_set_actuator",
      "name": "Ambient 80",
      "props": {
        "path": "Vehicle.Cabin.Light.AmbientLight.Row1.DriverSide.Intensity",
        "value": 80,
        "awaitAck": true,
        "onError": "continue"
      },
      "parentId": "b2",
      "blockVersion": 1
    },
    {
      "id": "b6",
      "type": "sv_log",
      "name": "Done",
      "props": {
        "level": "info",
        "message": "welcome done"
      },
      "parentId": null,
      "blockVersion": 1
    }
  ],
  "edges": [
    {
      "id": "e1",
      "from": "b1",
      "fromHandle": "source",
      "to": "b2",
      "toHandle": "target"
    },
    {
      "id": "e2",
      "from": "b2",
      "fromHandle": "parallel-start-source",
      "to": "b3",
      "toHandle": "target"
    },
    {
      "id": "e3",
      "from": "b2",
      "fromHandle": "parallel-start-source",
      "to": "b4",
      "toHandle": "target"
    },
    {
      "id": "e4",
      "from": "b4",
      "fromHandle": "source",
      "to": "b5",
      "toHandle": "target"
    },
    {
      "id": "e5",
      "from": "b2",
      "fromHandle": "parallel-end-source",
      "to": "b6",
      "toHandle": "target"
    }
  ]
}
