{
  "graphVersion": "1.0.0",
  "workflowId": "c34_stop_workflow",
  "revision": 1,
  "name": "stop(workflow) cancels every waiting run of the workflow",
  "vss": {
    "release": "v4.0"
  },
  "variables": [],
  "blocks": [
    {
      "id": "b1",
      "type": "sv_on_signal_changed",
      "name": "trig",
      "props": {
        "path": "Vehicle.Speed",
        "mode": "any",
        "debounceMs": 0,
        "concurrency": "parallel"
      },
      "parentId": null,
      "blockVersion": 1
    },
    {
      "id": "b2",
      "type": "sv_wait",
      "name": "wait2",
      "props": {
        "durationMs": 1000
      },
      "parentId": null,
      "blockVersion": 1
    },
    {
      "id": "b3",
      "type": "sv_set_actuator",
      "name": "set3",
      "props": {
        "path": "Vehicle.Cabin.HVAC.Station.Row1.Driver.FanSpeed",
        "value": "<trig.value>",
        "awaitAck": true,
        "onError": "continue"
      },
      "parentId": null,
      "blockVersion": 1
    },
    {
      "id": "b4",
      "type": "sv_on_signal_changed",
      "name": "moving",
      "props": {
        "path": "Vehicle.IsMoving",
        "mode": "becomes",
        "debounceMs": 0,
        "concurrency": "restart",
        "threshold": true
      },
      "parentId": null,
      "blockVersion": 1
    },
    {
      "id": "b5",
      "type": "sv_stop",
      "name": "stopall",
      "props": {
        "scope": "workflow"
      },
      "parentId": null,
      "blockVersion": 1
    }
  ],
  "edges": [
    {
      "id": "e1",
      "from": "b1",
      "fromHandle": "source",
      "to": "b2",
      "toHandle": "target"
    },
    {
      "id": "e2",
      "from": "b2",
      "fromHandle": "source",
      "to": "b3",
      "toHandle": "target"
    },
    {
      "id": "e3",
      "from": "b4",
      "fromHandle": "source",
      "to": "b5",
      "toHandle": "target"
    }
  ]
}
