{
  "graphVersion": "1.0.0",
  "workflowId": "gw_d",
  "revision": 1,
  "name": "Auto Door Lock",
  "vss": {
    "release": "v4.0"
  },
  "variables": [],
  "blocks": [
    {
      "id": "b1",
      "type": "sv_on_signal_changed",
      "name": "Above 15",
      "props": {
        "path": "Vehicle.Speed",
        "mode": "crosses_above",
        "threshold": 15,
        "debounceMs": 0,
        "concurrency": "ignore"
      },
      "parentId": null,
      "blockVersion": 1
    },
    {
      "id": "b2",
      "type": "sv_set_actuator",
      "name": "Lock 1",
      "props": {
        "path": "Vehicle.Cabin.Door.Row1.DriverSide.IsLocked",
        "value": true,
        "awaitAck": true,
        "onError": "continue"
      },
      "parentId": null,
      "blockVersion": 1
    },
    {
      "id": "b3",
      "type": "sv_set_actuator",
      "name": "Lock 2",
      "props": {
        "path": "Vehicle.Cabin.Door.Row1.PassengerSide.IsLocked",
        "value": true,
        "awaitAck": true,
        "onError": "continue"
      },
      "parentId": null,
      "blockVersion": 1
    },
    {
      "id": "b4",
      "type": "sv_set_actuator",
      "name": "Lock 3",
      "props": {
        "path": "Vehicle.Cabin.Door.Row2.DriverSide.IsLocked",
        "value": true,
        "awaitAck": true,
        "onError": "continue"
      },
      "parentId": null,
      "blockVersion": 1
    },
    {
      "id": "b5",
      "type": "sv_set_actuator",
      "name": "Lock 4",
      "props": {
        "path": "Vehicle.Cabin.Door.Row2.PassengerSide.IsLocked",
        "value": true,
        "awaitAck": true,
        "onError": "continue"
      },
      "parentId": null,
      "blockVersion": 1
    }
  ],
  "edges": [
    {
      "id": "e1",
      "from": "b1",
      "fromHandle": "source",
      "to": "b2",
      "toHandle": "target"
    },
    {
      "id": "e2",
      "from": "b2",
      "fromHandle": "source",
      "to": "b3",
      "toHandle": "target"
    },
    {
      "id": "e3",
      "from": "b3",
      "fromHandle": "source",
      "to": "b4",
      "toHandle": "target"
    },
    {
      "id": "e4",
      "from": "b4",
      "fromHandle": "source",
      "to": "b5",
      "toHandle": "target"
    }
  ]
}
