{
  "graphVersion": "1.0.0",
  "workflowId": "c18_wait",
  "revision": 1,
  "name": "wait is a yield point: the step after it runs durationMs later",
  "vss": {
    "release": "v4.0"
  },
  "variables": [],
  "blocks": [
    {
      "id": "b1",
      "type": "sv_on_app_start",
      "name": "start",
      "props": {},
      "parentId": null,
      "blockVersion": 1
    },
    {
      "id": "b2",
      "type": "sv_set_actuator",
      "name": "set2",
      "props": {
        "path": "Vehicle.Cabin.HVAC.Station.Row1.Driver.FanSpeed",
        "value": 1,
        "awaitAck": true,
        "onError": "continue"
      },
      "parentId": null,
      "blockVersion": 1
    },
    {
      "id": "b3",
      "type": "sv_wait",
      "name": "wait3",
      "props": {
        "durationMs": 500
      },
      "parentId": null,
      "blockVersion": 1
    },
    {
      "id": "b4",
      "type": "sv_set_actuator",
      "name": "set4",
      "props": {
        "path": "Vehicle.Cabin.HVAC.Station.Row1.Driver.FanSpeed",
        "value": 2,
        "awaitAck": true,
        "onError": "continue"
      },
      "parentId": null,
      "blockVersion": 1
    }
  ],
  "edges": [
    {
      "id": "e1",
      "from": "b1",
      "fromHandle": "source",
      "to": "b2",
      "toHandle": "target"
    },
    {
      "id": "e2",
      "from": "b2",
      "fromHandle": "source",
      "to": "b3",
      "toHandle": "target"
    },
    {
      "id": "e3",
      "from": "b3",
      "fromHandle": "source",
      "to": "b4",
      "toHandle": "target"
    }
  ]
}
