{
  "graphVersion": "1.0.0",
  "workflowId": "c21_switch",
  "revision": 1,
  "name": "Switch takes the first matching case-<i>, else default",
  "vss": {
    "release": "v4.0"
  },
  "variables": [],
  "blocks": [
    {
      "id": "b1",
      "type": "sv_on_signal_changed",
      "name": "trig",
      "props": {
        "path": "Vehicle.Speed",
        "mode": "any",
        "debounceMs": 0,
        "concurrency": "restart"
      },
      "parentId": null,
      "blockVersion": 1
    },
    {
      "id": "b2",
      "type": "sv_switch",
      "name": "pick",
      "props": {
        "value": "<trig.value>",
        "cases": [
          {
            "when": "10"
          },
          {
            "when": "20"
          }
        ]
      },
      "parentId": null,
      "blockVersion": 1
    },
    {
      "id": "b3",
      "type": "sv_set_actuator",
      "name": "set3",
      "props": {
        "path": "Vehicle.Cabin.HVAC.Station.Row1.Driver.FanSpeed",
        "value": 1,
        "awaitAck": true,
        "onError": "continue"
      },
      "parentId": null,
      "blockVersion": 1
    },
    {
      "id": "b4",
      "type": "sv_set_actuator",
      "name": "set4",
      "props": {
        "path": "Vehicle.Cabin.HVAC.Station.Row1.Driver.FanSpeed",
        "value": 2,
        "awaitAck": true,
        "onError": "continue"
      },
      "parentId": null,
      "blockVersion": 1
    },
    {
      "id": "b5",
      "type": "sv_set_actuator",
      "name": "set5",
      "props": {
        "path": "Vehicle.Cabin.HVAC.Station.Row1.Driver.FanSpeed",
        "value": 0,
        "awaitAck": true,
        "onError": "continue"
      },
      "parentId": null,
      "blockVersion": 1
    }
  ],
  "edges": [
    {
      "id": "e1",
      "from": "b1",
      "fromHandle": "source",
      "to": "b2",
      "toHandle": "target"
    },
    {
      "id": "e2",
      "from": "b2",
      "fromHandle": "case-0",
      "to": "b3",
      "toHandle": "target"
    },
    {
      "id": "e3",
      "from": "b2",
      "fromHandle": "case-1",
      "to": "b4",
      "toHandle": "target"
    },
    {
      "id": "e4",
      "from": "b2",
      "fromHandle": "default",
      "to": "b5",
      "toHandle": "target"
    }
  ]
}
