{
  "graphVersion": "1.0.0",
  "workflowId": "c08_initial_is_baseline",
  "revision": 1,
  "name": "Values present at app start are the baseline: no trigger at t=0",
  "vss": {
    "release": "v4.0"
  },
  "variables": [],
  "blocks": [
    {
      "id": "b1",
      "type": "sv_on_signal_changed",
      "name": "trig",
      "props": {
        "path": "Vehicle.Speed",
        "mode": "any",
        "debounceMs": 0,
        "concurrency": "restart"
      },
      "parentId": null,
      "blockVersion": 1
    },
    {
      "id": "b2",
      "type": "sv_set_actuator",
      "name": "set2",
      "props": {
        "path": "Vehicle.Body.Lights.Hazard.IsSignaling",
        "value": true,
        "awaitAck": true,
        "onError": "continue"
      },
      "parentId": null,
      "blockVersion": 1
    }
  ],
  "edges": [
    {
      "id": "e1",
      "from": "b1",
      "fromHandle": "source",
      "to": "b2",
      "toHandle": "target"
    }
  ]
}
